{
  "$schema": "./game-agent-evaluation-v1.schema.json",
  "schemaVersion": 1,
  "suiteId": "m12.game-agent-evaluation",
  "version": "1.0.0",
  "title": "AI-native game authoring cross-genre evaluation",
  "oracleVisibility": "runner-only",
  "sharedEnvironment": {
    "projectTemplate": "blank-game-document-v2",
    "viewport": { "width": 1280, "height": 720 },
    "simulationHz": 60,
    "seed": 20260824,
    "assetPolicy": "builtin-or-procedural-only",
    "modes": ["cold-create", "warm-repair", "seeded-defect"]
  },
  "sharedBudgets": {
    "maxAgentTurns": 8,
    "maxToolCalls": 120,
    "maxRepairIterations": 3,
    "maxWallTimeMs": 900000,
    "maxObservationBytes": 16777216,
    "costPolicy": "record-only"
  },
  "cases": [
    {
      "id": "game-eval:snake:v1",
      "genre": "snake",
      "title": "可重玩的贪吃蛇",
      "request": "制作一个完整可玩的贪吃蛇游戏。玩家用方向键控制移动，吃到食物后身体增长并得分，撞到边界或自己时结束，并能一键重新开始。",
      "requestVariants": [
        {
          "id": "concise",
          "request": "做一款节奏明快的贪吃蛇：方向键移动、吃食物变长、显示分数、碰撞失败，并提供清晰的重新开始入口。"
        },
        {
          "id": "experience-first",
          "request": "我想要一个开箱即玩的贪吃蛇小游戏，画面上要容易区分蛇头、身体与食物，操作后立刻有反馈，失败后无需刷新页面即可再来一局。"
        }
      ],
      "agentVisibleConstraints": [
        "从空白项目开始，不使用外部下载素材。",
        "游戏必须在编辑器 Play 模式内完成全部交互和重新开始。",
        "键盘输入、得分和游戏状态需要可被编辑器观察。"
      ],
      "requiredCapabilities": [
        "input.keyboard",
        "simulation.fixed-step",
        "simulation.replay",
        "play.inspect",
        "play.capture"
      ],
      "inputReplay": {
        "driver": "fixed",
        "steps": [
          { "id": "verify-gameplay", "at": "play-ready", "action": "scripted-verify-snake", "parameters": { "collections": 2 } },
          { "id": "restart", "at": "after:game-over", "action": "press", "control": "KeyR", "durationTicks": 1 }
        ]
      },
      "acceptance": {
        "functional": [
          { "id": "snake.direction-and-step", "assertion": "方向输入会改变蛇的移动方向，且不会允许立即反向穿过自身。", "evidence": ["state", "input-replay"] },
          { "id": "snake.food-growth-score", "assertion": "蛇连续吃到至少两份食物时长度和分数会逐次增加；每次生成的新食物都位于可玩区域，且画面位置与逻辑位置同步。", "evidence": ["state", "event-trace", "screenshot"] },
          { "id": "snake.collision-restart", "assertion": "边界或自身碰撞进入失败状态，重新开始会恢复初始长度、分数和运动。", "evidence": ["state", "lifecycle", "input-replay"] }
        ],
        "visual": [
          { "id": "snake.roles-legible", "assertion": "蛇头、蛇身、食物、边界、分数和失败状态在截图中清晰可辨且不重叠遮挡。", "evidence": ["screenshot", "state"] }
        ],
        "robustness": [
          { "id": "snake.long-run-stable", "assertion": "连续运行五分钟或多次重新开始后没有未处理异常、重复监听器或明显速度漂移。", "evidence": ["performance", "lifecycle", "log"] }
        ]
      },
      "failureSeeds": [
        { "id": "snake-no-self-collision", "description": "关闭蛇身自碰撞检测，验证行为 oracle 能发现核心规则缺失。", "expectedFailedAcceptanceIds": ["snake.collision-restart"] },
        { "id": "snake-hidden-score", "description": "把分数文字移出 viewport，验证截图与状态证据能够共同定位问题。", "expectedFailedAcceptanceIds": ["snake.roles-legible"] },
        { "id": "snake-stale-food-visual", "description": "逻辑食物重生后保留旧位置的食物模型，验证连续增长与视觉状态同步。", "expectedFailedAcceptanceIds": ["snake.food-growth-score"] }
      ]
    },
    {
      "id": "game-eval:match-3:v1",
      "genre": "match-3",
      "title": "带连锁结算的消消乐",
      "request": "制作一个可玩的消消乐关卡。玩家交换相邻方块，三个及以上同类连线后消除，方块下落并补充，连续消除会累计分数；无效交换应恢复，并可重新开始。",
      "requestVariants": [
        {
          "id": "goal-oriented",
          "request": "做一个有明确分数目标的消消乐小游戏：点击或拖动交换相邻元素，匹配后消除和补位，达到目标显示胜利，步数用尽显示失败。"
        },
        {
          "id": "feedback-oriented",
          "request": "创建一关手感清楚的三消游戏，合法交换要有消除、下落和连锁反馈，非法交换要弹回；玩家随时看得到步数、分数和结算状态。"
        }
      ],
      "agentVisibleConstraints": [
        "棋盘必须由固定 seed 生成，初始局面不能自动存在三连。",
        "鼠标或触摸式指针交互必须在 Play 模式中可复现。",
        "不使用外部下载素材，使用内置图形或程序化视觉。"
      ],
      "requiredCapabilities": [
        "input.pointer",
        "input.inject",
        "interaction.pointer",
        "simulation.fixed-step",
        "simulation.replay",
        "play.inspect",
        "play.capture"
      ],
      "inputReplay": {
        "driver": "fixed",
        "steps": [
          { "id": "invalid-swap", "at": "play-ready", "action": "scripted-swap", "parameters": { "kind": "non-matching-adjacent" } },
          { "id": "valid-swap", "at": "after:invalid-swap-settled", "action": "scripted-swap", "parameters": { "kind": "creates-match", "minimumRun": 3 } },
          { "id": "repeat-valid", "at": "after:board-settled", "action": "scripted-repeat-valid-swaps", "parameters": { "count": 5 } },
          { "id": "restart", "at": "after:terminal-state", "action": "press", "control": "KeyR", "durationTicks": 1 }
        ]
      },
      "acceptance": {
        "functional": [
          { "id": "match3.invalid-swap-restores", "assertion": "没有形成匹配的相邻交换会回到原位，且不消耗错误的分数或破坏棋盘。", "evidence": ["state", "input-replay", "event-trace"] },
          { "id": "match3.clear-drop-refill", "assertion": "三连及以上会被识别和清除，上方元素按重力下落，空位被补齐且最终棋盘稳定。", "evidence": ["state", "event-trace"] },
          { "id": "match3.score-terminal-restart", "assertion": "消除与连锁正确计分，目标或步数触发结算，重新开始恢复完整初始状态。", "evidence": ["state", "lifecycle"] }
        ],
        "visual": [
          { "id": "match3.board-feedback-legible", "assertion": "棋盘格、不同元素、选中态、交换/消除反馈、步数、分数和结算层均清晰可辨。", "evidence": ["screenshot", "state"] }
        ],
        "robustness": [
          { "id": "match3.settle-no-deadlock", "assertion": "多次连锁与快速输入后棋盘仍会进入稳定可操作状态，不残留锁定或悬空元素。", "evidence": ["state", "performance", "log"] }
        ]
      },
      "failureSeeds": [
        { "id": "match3-skip-refill", "description": "消除后不补充空位，验证棋盘完整性和稳定状态断言。", "expectedFailedAcceptanceIds": ["match3.clear-drop-refill"] },
        { "id": "match3-input-lock", "description": "在首次消除后保留输入锁，验证连续可玩性检测。", "expectedFailedAcceptanceIds": ["match3.settle-no-deadlock"] }
      ]
    },
    {
      "id": "game-eval:falling-blocks:v1",
      "genre": "falling-blocks",
      "title": "俄罗斯方块式落块游戏",
      "request": "制作一个俄罗斯方块式落块游戏。方块持续下落，玩家可左右移动、旋转、软降和硬降；完整横行会消除并得分，速度随进度提升，堆叠到顶部时结束并可重开。",
      "requestVariants": [
        {
          "id": "classic",
          "request": "做一款经典落块消行游戏，包含下一块预览、分数与等级，支持键盘移动旋转和快速落下，失败后能立即重新开始。"
        },
        {
          "id": "systems-first",
          "request": "创建一个完整的下落方块玩法：七种基本形状按确定性序列出现，碰撞后锁定，满行清除，等级越高下落越快，并正确处理顶部失败。"
        }
      ],
      "agentVisibleConstraints": [
        "方块序列使用固定 seed，保证 Play replay 可重复。",
        "输入至少覆盖左右移动、旋转、软降、硬降和重新开始。",
        "游戏逻辑使用固定 simulation tick，不依赖墙钟计时。"
      ],
      "requiredCapabilities": [
        "input.keyboard",
        "simulation.fixed-step",
        "simulation.replay",
        "play.inspect",
        "play.capture"
      ],
      "inputReplay": {
        "driver": "fixed",
        "steps": [
          { "id": "move-rotate", "at": "play-ready", "action": "sequence", "parameters": { "controls": ["ArrowLeft", "ArrowLeft", "ArrowUp"] } },
          { "id": "hard-drop", "at": "tick:30", "action": "press", "control": "Space", "durationTicks": 1 },
          { "id": "build-line", "at": "after:piece-locked", "action": "scripted-place-pieces", "parameters": { "goal": "clear-at-least-one-line" } },
          { "id": "restart", "at": "after:game-over", "action": "press", "control": "KeyR", "durationTicks": 1 }
        ]
      },
      "acceptance": {
        "functional": [
          { "id": "blocks.transform-collision", "assertion": "移动和旋转遵守棋盘边界与已锁定方块碰撞，不产生越界或重叠占格。", "evidence": ["state", "input-replay"] },
          { "id": "blocks.lock-clear-score", "assertion": "落块接触后锁定，完整横行同时清除，棋盘压缩且分数按清除行数增加。", "evidence": ["state", "event-trace"] },
          { "id": "blocks.progression-gameover", "assertion": "进度会提升等级和下落速度，顶部堆满后停止生成并进入可重新开始的失败状态。", "evidence": ["state", "lifecycle"] }
        ],
        "visual": [
          { "id": "blocks.playfield-readable", "assertion": "活动方块、锁定方块、棋盘边界、下一块、分数、等级和失败状态在截图中清楚且布局稳定。", "evidence": ["screenshot", "state"] }
        ],
        "robustness": [
          { "id": "blocks.rapid-input-stable", "assertion": "快速交替旋转、移动与硬降不会复制方块、穿透棋盘或产生未处理异常。", "evidence": ["state", "performance", "log"] }
        ]
      },
      "failureSeeds": [
        { "id": "blocks-no-wall-kick-boundary", "description": "允许旋转后的方块越过棋盘边界，验证占格和碰撞断言。", "expectedFailedAcceptanceIds": ["blocks.transform-collision"] },
        { "id": "blocks-line-not-compressed", "description": "清行后不下移上方方块，验证行清理后的棋盘状态。", "expectedFailedAcceptanceIds": ["blocks.lock-clear-score"] }
      ]
    },
    {
      "id": "game-eval:jigsaw:v1",
      "genre": "jigsaw",
      "title": "拖拽吸附拼图",
      "request": "制作一个十二块的拼图游戏。拼图片散布在桌面上，玩家拖动到正确位置附近时自动吸附，错误位置不会锁定；完成后显示用时和成功反馈，并可打乱后重玩。",
      "requestVariants": [
        {
          "id": "casual",
          "request": "做一个轻量拼图小游戏，所有拼图片一开始都能看到，拖到目标附近会自然吸附，拼完有庆祝效果，也可以随时重新洗牌。"
        },
        {
          "id": "interaction-first",
          "request": "创建一个 3×4 拼图：支持鼠标拖拽、置顶当前拼图片、错误释放后保留可继续操作的位置，正确放置后锁定，全部完成后给出结果。"
        }
      ],
      "agentVisibleConstraints": [
        "使用内置或程序化图案，不下载外部图片。",
        "打乱过程使用固定 seed，并保证所有拼图片仍在 viewport 内。",
        "拖拽、释放、吸附和重新洗牌均须在 Play 模式完成。"
      ],
      "requiredCapabilities": [
        "input.pointer",
        "input.inject",
        "interaction.pointer",
        "simulation.replay",
        "play.inspect",
        "play.capture"
      ],
      "inputReplay": {
        "driver": "fixed",
        "steps": [
          { "id": "wrong-drop", "at": "play-ready", "action": "scripted-drag-piece", "parameters": { "destination": "wrong-slot", "release": true } },
          { "id": "near-correct", "at": "after:wrong-drop", "action": "scripted-drag-piece", "parameters": { "destination": "near-correct-slot", "release": true } },
          { "id": "complete", "at": "after:first-piece-locked", "action": "scripted-complete-jigsaw", "parameters": { "order": "stable" } },